{
  "schema_version": 1,
  "version": "2026.10.1",
  "note": "English is always required and comes first. The languages per country are suggestions the app offers; users can add any language from the list. Regions are first-level administrative areas.",
  "default_language": "en",
  "languages": [
    {
      "code": "en",
      "name": "English",
      "rtl": false
    },
    {
      "code": "am",
      "name": "Amharic",
      "rtl": false
    },
    {
      "code": "ar",
      "name": "Arabic",
      "rtl": true
    },
    {
      "code": "bn",
      "name": "Bengali",
      "rtl": false
    },
    {
      "code": "my",
      "name": "Burmese",
      "rtl": false
    },
    {
      "code": "prs",
      "name": "Dari",
      "rtl": true
    },
    {
      "code": "fr",
      "name": "French",
      "rtl": false
    },
    {
      "code": "ha",
      "name": "Hausa",
      "rtl": false
    },
    {
      "code": "ku",
      "name": "Kurdish",
      "rtl": false,
      "note": "Macrolanguage code. Sorani (ckb) is written right to left in Arabic script; Kurmanji (kmr) in Latin script. An adviser should split this when Iraq content is encoded."
    },
    {
      "code": "ps",
      "name": "Pashto",
      "rtl": true
    },
    {
      "code": "fa",
      "name": "Persian (Farsi)",
      "rtl": true
    },
    {
      "code": "pt",
      "name": "Portuguese",
      "rtl": false
    },
    {
      "code": "sg",
      "name": "Sango",
      "rtl": false
    },
    {
      "code": "so",
      "name": "Somali",
      "rtl": false
    },
    {
      "code": "es",
      "name": "Spanish",
      "rtl": false
    },
    {
      "code": "sw",
      "name": "Swahili",
      "rtl": false
    },
    {
      "code": "uk",
      "name": "Ukrainian",
      "rtl": false
    }
  ],
  "countries": [
    {
      "name": "Afghanistan",
      "regions": [
        "Badakhshan",
        "Badghis",
        "Baghlan",
        "Balkh",
        "Bamiyan",
        "Daykundi",
        "Farah",
        "Faryab",
        "Ghazni",
        "Ghor",
        "Helmand",
        "Herat",
        "Jowzjan",
        "Kabul",
        "Kandahar",
        "Kapisa",
        "Khost",
        "Kunar",
        "Kunduz",
        "Laghman",
        "Logar",
        "Nangarhar",
        "Nimroz",
        "Nuristan",
        "Paktia",
        "Paktika",
        "Panjsher",
        "Parwan",
        "Samangan",
        "Sar-e Pol",
        "Takhar",
        "Uruzgan",
        "Wardak",
        "Zabul"
      ],
      "languages": [
        "prs",
        "ps"
      ]
    },
    {
      "name": "Bangladesh",
      "regions": [
        "Barisal",
        "Chittagong",
        "Dhaka",
        "Khulna",
        "Mymensingh",
        "Rajshahi",
        "Rangpur",
        "Sylhet"
      ],
      "languages": [
        "bn"
      ]
    },
    {
      "name": "Burkina Faso",
      "regions": [
        "Boucle du Mouhoun",
        "Cascades",
        "Centre",
        "Centre-Est",
        "Centre-Nord",
        "Centre-Ouest",
        "Centre-Sud",
        "Est",
        "Hauts-Bassins",
        "Nord",
        "Plateau-Central",
        "Sahel",
        "Sud-Ouest"
      ],
      "languages": [
        "fr"
      ]
    },
    {
      "name": "Cameroon",
      "regions": [
        "Adamawa",
        "Centre",
        "East",
        "Far North",
        "Littoral",
        "North",
        "North West",
        "South",
        "South West",
        "West"
      ],
      "languages": [
        "fr"
      ]
    },
    {
      "name": "Central African Republic",
      "regions": [
        "Bangui",
        "Bamingui-Bangoran",
        "Basse-Kotto",
        "Haute-Kotto",
        "Haut-Mbomou",
        "Kémo",
        "Lobaye",
        "Mambéré-Kadéï",
        "Mbomou",
        "Nana-Gribizi",
        "Nana-Mambéré",
        "Ombella-M'Poko",
        "Ouaka",
        "Ouham",
        "Ouham-Pendé",
        "Sangha-Mbaéré",
        "Vakaga"
      ],
      "languages": [
        "fr",
        "sg"
      ]
    },
    {
      "name": "Colombia",
      "regions": [
        "Amazonas",
        "Antioquia",
        "Arauca",
        "Atlántico",
        "Bogotá D.C.",
        "Bolívar",
        "Boyacá",
        "Caldas",
        "Caquetá",
        "Casanare",
        "Cauca",
        "Cesar",
        "Chocó",
        "Córdoba",
        "Cundinamarca",
        "Guainía",
        "Guaviare",
        "Huila",
        "La Guajira",
        "Magdalena",
        "Meta",
        "Nariño",
        "Norte de Santander",
        "Putumayo",
        "Quindío",
        "Risaralda",
        "San Andrés y Providencia",
        "Santander",
        "Sucre",
        "Tolima",
        "Valle del Cauca",
        "Vaupés",
        "Vichada"
      ],
      "languages": [
        "es"
      ]
    },
    {
      "name": "Democratic Republic of the Congo",
      "regions": [
        "Bas-Uele",
        "Équateur",
        "Haut-Katanga",
        "Haut-Lomami",
        "Haut-Uele",
        "Ituri",
        "Kasaï",
        "Kasaï Central",
        "Kasaï Oriental",
        "Kinshasa",
        "Kongo Central",
        "Kwango",
        "Kwilu",
        "Lomami",
        "Lualaba",
        "Mai-Ndombe",
        "Maniema",
        "Mongala",
        "Nord-Kivu",
        "Nord-Ubangi",
        "Sankuru",
        "Sud-Kivu",
        "Sud-Ubangi",
        "Tanganyika",
        "Tshopo",
        "Tshuapa"
      ],
      "languages": [
        "fr",
        "sw"
      ]
    },
    {
      "name": "Ecuador",
      "regions": [
        "Azuay",
        "Bolívar",
        "Cañar",
        "Carchi",
        "Chimborazo",
        "Cotopaxi",
        "El Oro",
        "Esmeraldas",
        "Galápagos",
        "Guayas",
        "Imbabura",
        "Loja",
        "Los Ríos",
        "Manabí",
        "Morona Santiago",
        "Napo",
        "Orellana",
        "Pastaza",
        "Pichincha",
        "Santa Elena",
        "Santo Domingo de los Tsáchilas",
        "Sucumbíos",
        "Tungurahua",
        "Zamora Chinchipe"
      ],
      "languages": [
        "es"
      ]
    },
    {
      "name": "Ethiopia",
      "regions": [
        "Addis Ababa",
        "Afar",
        "Amhara",
        "Benishangul-Gumuz",
        "Dire Dawa",
        "Gambela",
        "Harari",
        "Oromia",
        "Sidama",
        "Somali",
        "South West Ethiopia Peoples'",
        "Southern Nations Nationalities and Peoples'",
        "Tigray"
      ],
      "languages": [
        "am"
      ]
    },
    {
      "name": "Honduras",
      "regions": [
        "Atlántida",
        "Choluteca",
        "Colón",
        "Comayagua",
        "Copán",
        "Cortés",
        "El Paraíso",
        "Francisco Morazán",
        "Gracias a Dios",
        "Intibucá",
        "Islas de la Bahía",
        "La Paz",
        "Lempira",
        "Ocotepeque",
        "Olancho",
        "Santa Bárbara",
        "Valle",
        "Yoro"
      ],
      "languages": [
        "es"
      ]
    },
    {
      "name": "Iran",
      "regions": [
        "Alborz",
        "Ardabil",
        "Bushehr",
        "Chaharmahal and Bakhtiari",
        "East Azerbaijan",
        "Esfahan",
        "Fars",
        "Gilan",
        "Golestan",
        "Hamadan",
        "Hormozgan",
        "Ilam",
        "Kerman",
        "Kermanshah",
        "Khuzestan",
        "Kohgiluyeh and Boyer-Ahmad",
        "Kurdistan",
        "Lorestan",
        "Markazi",
        "Mazandaran",
        "North Khorasan",
        "Qazvin",
        "Qom",
        "Razavi Khorasan",
        "Semnan",
        "Sistan and Baluchestan",
        "South Khorasan",
        "Tehran",
        "West Azerbaijan",
        "Yazd",
        "Zanjan"
      ],
      "languages": [
        "fa"
      ]
    },
    {
      "name": "Iraq",
      "regions": [
        "Al Anbar",
        "Al Muthanna",
        "Al Qādisiyyah",
        "An Najaf",
        "Arbil",
        "As Sulaymaniyah",
        "Babil",
        "Baghdad",
        "Basra",
        "Dahuk",
        "Dhi Qar",
        "Diyala",
        "Halabja",
        "Karbala",
        "Kirkuk",
        "Maysan",
        "Ninewa",
        "Saladin",
        "Wasit"
      ],
      "languages": [
        "ar",
        "ku"
      ]
    },
    {
      "name": "Jordan",
      "regions": [
        "Ajloun",
        "Amman",
        "Aqaba",
        "Balqa",
        "Irbid",
        "Jarash",
        "Karak",
        "Ma'an",
        "Madaba",
        "Mafraq",
        "Tafilah",
        "Zarqa"
      ],
      "languages": [
        "ar"
      ]
    },
    {
      "name": "Kenya",
      "regions": [
        "Baringo",
        "Bomet",
        "Bungoma",
        "Busia",
        "Elgeyo-Marakwet",
        "Embu",
        "Garissa",
        "Homa Bay",
        "Isiolo",
        "Kajiado",
        "Kakamega",
        "Kericho",
        "Kiambu",
        "Kilifi",
        "Kirinyaga",
        "Kisii",
        "Kisumu",
        "Kitui",
        "Kwale",
        "Laikipia",
        "Lamu",
        "Machakos",
        "Makueni",
        "Mandera",
        "Marsabit",
        "Meru",
        "Migori",
        "Mombasa",
        "Murang'a",
        "Nairobi",
        "Nakuru",
        "Nandi",
        "Narok",
        "Nyamira",
        "Nyandarua",
        "Nyeri",
        "Samburu",
        "Siaya",
        "Taita-Taveta",
        "Tana River",
        "Tharaka-Nithi",
        "Trans Nzoia",
        "Turkana",
        "Uasin Gishu",
        "Vihiga",
        "Wajir",
        "West Pokot"
      ],
      "languages": [
        "sw"
      ]
    },
    {
      "name": "Lebanon",
      "regions": [
        "Akkar",
        "Baalbek-Hermel",
        "Beirut",
        "Bekaa",
        "Mount Lebanon",
        "Nabatieh",
        "North Lebanon",
        "South Lebanon"
      ],
      "languages": [
        "ar"
      ]
    },
    {
      "name": "Libya",
      "regions": [
        "Al Butnan",
        "Al Jabal al Akhdar",
        "Al Jabal al Gharbi",